{
  "schema_version": 1,
  "policy_source": "docs/llm-provider-migration.md#3-routing-policy (v1.1)",
  "revised": "2026-09-11",
  "defaults": {
    "request_timeout_ms": {
      "hot-path": 30000,
      "background": 90000,
      "batch": 300000
    },
    "retries_per_leg": 1,
    "circuit_breaker": {
      "failure_threshold": 5,
      "cooldown_ms": 60000,
      "capacity_cooldown_ms": 15000,
      "half_open_probes": 1
    }
  },
  "providers": {
    "anthropic": {
      "display_name": "Anthropic",
      "tier": "closed",
      "api_style": "anthropic",
      "base_url": null,
      "base_url_env": null,
      "api_key_env": "ANTHROPIC_API_KEY",
      "secret_path": "llm/anthropic/apiKey",
      "account_status": "live",
      "lumic_provider": "anthropic",
      "published_rpm": null,
      "published_tpm": null,
      "limits_source": null,
      "docs_url": "https://docs.claude.com/en/api/overview",
      "notes": "Permanent designated tier. Retained, keyed, budgeted and continuously exercised as the revert target of every alias (PD-11)."
    },
    "openai": {
      "display_name": "OpenAI",
      "tier": "closed",
      "api_style": "openai-compatible",
      "base_url": null,
      "base_url_env": null,
      "api_key_env": "OPENAI_API_KEY",
      "secret_path": "llm/openai/apiKey",
      "account_status": "live",
      "lumic_provider": "openai",
      "published_rpm": null,
      "published_tpm": null,
      "limits_source": null,
      "docs_url": "https://platform.openai.com/docs/api-reference",
      "notes": "Permanent designated tier. No alias routes to it today; it stays keyed and budgeted so a per-alias revert to an OpenAI incumbent is a config change (PD-11)."
    },
    "deepinfra": {
      "display_name": "DeepInfra",
      "tier": "open",
      "api_style": "openai-compatible",
      "base_url": "https://api.deepinfra.com/v1/openai",
      "base_url_env": "DEEPINFRA_BASE_URL",
      "api_key_env": "DEEPINFRA_API_KEY",
      "secret_path": "llm/deepinfra/apiKey",
      "account_status": "live",
      "lumic_provider": null,
      "published_rpm": null,
      "published_tpm": null,
      "limits_source": null,
      "docs_url": "https://deepinfra.com/docs",
      "notes": "Sole open-weight host. The routing policy originally spread these models across Z.ai first-party, DeepInfra and Groq; DeepInfra's catalogue carries all of them, so consolidating removes three onboardings, three keys and three terms filings at the cost of roughly 28% on llm.reason's input price versus the first-party GLM anchor. Fewer credentials and fewer trust boundaries is worth more than that margin on one alias."
    },
    "fireworks": {
      "display_name": "Fireworks AI",
      "tier": "open",
      "api_style": "openai-compatible",
      "base_url": "https://api.fireworks.ai/inference/v1",
      "base_url_env": "FIREWORKS_BASE_URL",
      "api_key_env": "FIREWORKS_API_KEY",
      "secret_path": "llm/fireworks/apiKey",
      "account_status": "not-in-scope",
      "lumic_provider": null,
      "published_rpm": null,
      "published_tpm": null,
      "limits_source": null,
      "docs_url": "https://docs.fireworks.ai",
      "notes": "Superseded by the DeepInfra consolidation: the models this host was chosen for are served from DeepInfra under one account. Retained in the registry so a future re-split needs a config change rather than a new onboarding."
    },
    "zai": {
      "display_name": "Z.ai",
      "tier": "open",
      "api_style": "openai-compatible",
      "base_url": "https://api.z.ai/api/paas/v4",
      "base_url_env": "ZAI_BASE_URL",
      "api_key_env": "ZAI_API_KEY",
      "secret_path": "llm/zai/apiKey",
      "account_status": "not-in-scope",
      "lumic_provider": null,
      "published_rpm": null,
      "published_tpm": null,
      "limits_source": null,
      "docs_url": "https://docs.z.ai",
      "notes": "Superseded by the DeepInfra consolidation: the models this host was chosen for are served from DeepInfra under one account. Retained in the registry so a future re-split needs a config change rather than a new onboarding."
    },
    "deepseek": {
      "display_name": "DeepSeek",
      "tier": "open",
      "api_style": "openai-compatible",
      "base_url": "https://api.deepseek.com",
      "base_url_env": "DEEPSEEK_BASE_URL",
      "api_key_env": "DEEPSEEK_API_KEY",
      "secret_path": "llm/deepseek/apiKey",
      "account_status": "not-in-scope",
      "lumic_provider": "deepseek",
      "published_rpm": null,
      "published_tpm": null,
      "limits_source": null,
      "docs_url": "https://api-docs.deepseek.com",
      "notes": "First-party DeepSeek API, no longer routed to. Its G1 filing found no commitment not to train on API inputs, no stated retention period, no sub-processor list, and storage under PRC jurisdiction — a materially weaker data posture than any other provider reviewed, and not one to send trading prompts through. The DeepSeek MODELS are still used and are a good fit; they are now served as open weights from DeepInfra under its Zero Data Retention commitment. The weights and the vendor's hosted API are separable, and only the API carried the exposure. Retained in the registry so the distinction stays visible rather than being rediscovered."
    },
    "groq": {
      "display_name": "Groq",
      "tier": "open",
      "api_style": "openai-compatible",
      "base_url": "https://api.groq.com/openai/v1",
      "base_url_env": "GROQ_BASE_URL",
      "api_key_env": "GROQ_API_KEY",
      "secret_path": "llm/groq/apiKey",
      "account_status": "not-in-scope",
      "lumic_provider": null,
      "published_rpm": null,
      "published_tpm": null,
      "limits_source": null,
      "docs_url": "https://console.groq.com/docs",
      "notes": "Superseded by the DeepInfra consolidation: the models this host was chosen for are served from DeepInfra under one account. Retained in the registry so a future re-split needs a config change rather than a new onboarding."
    },
    "openrouter": {
      "display_name": "OpenRouter",
      "tier": "aggregator",
      "api_style": "openai-compatible",
      "base_url": "https://openrouter.ai/api/v1",
      "base_url_env": "OPENROUTER_BASE_URL",
      "api_key_env": "OPENROUTER_API_KEY",
      "secret_path": "llm/openrouter/apiKey",
      "account_status": "pending-onboarding",
      "lumic_provider": null,
      "published_rpm": null,
      "published_tpm": null,
      "limits_source": null,
      "docs_url": "https://openrouter.ai/docs",
      "notes": "Aggregator backstop. Reaches an open-weight model when its dedicated host is down, without a new account. Not a chain leg by default: an aggregator hides which upstream served a call, which defeats per-provider attribution."
    }
  },
  "aliases": {
    "llm.reason": {
      "workload": "Deep reasoning, audit loops, config tuning",
      "latency_class": "background",
      "criticality": "ops",
      "isolation_capable": true,
      "eval_gate": "free-text-judge",
      "budget": {
        "basis": "provisional-pre-baseline",
        "monthly_usd": 750,
        "alert_pct": [
          50,
          80,
          100
        ]
      },
      "routes": [
        {
          "role": "primary",
          "provider": "deepinfra",
          "model_id": "deepseek-ai/DeepSeek-V4-Pro",
          "model_id_status": "confirmed",
          "model_id_source": "DeepInfra /v1/openai/models catalogue queried against the live account 2026-09-11; tool-calling and latency verified by direct call on the same account",
          "model_family": "DeepSeek V4 Pro",
          "lumic_model": "deepseek-ai/DeepSeek-V4-Pro",
          "params": {
            "temperature": null,
            "max_output_tokens": null,
            "supports_temperature": true,
            "supports_json_schema": true,
            "supports_tools": true,
            "supports_cache_control": true,
            "supports_vision": false,
            "supports_tool_choice": false,
            "context_window": 1048576
          },
          "price_per_mtok": {
            "input": 1.3,
            "output": 2.6,
            "as_of": "2026-09-11",
            "source": "DeepInfra /v1/openai/models catalogue queried against the live account 2026-09-11; tool-calling and latency verified by direct call on the same account"
          },
          "notes": "1.6T MoE, 49B active, 1M context. Its model card cites advanced reasoning and long-running agent tasks, and it is the cheapest model in the flagship tier by a wide margin — a quarter of the incumbent's input price and a tenth of its output price."
        },
        {
          "role": "secondary",
          "provider": "deepinfra",
          "model_id": "zai-org/GLM-5.3",
          "model_id_status": "confirmed",
          "model_id_source": "DeepInfra /v1/openai/models catalogue queried against the live account 2026-09-11; tool-calling and latency verified by direct call on the same account",
          "model_family": "GLM-5.3",
          "lumic_model": "zai-org/GLM-5.3",
          "params": {
            "temperature": null,
            "max_output_tokens": null,
            "supports_temperature": true,
            "supports_json_schema": true,
            "supports_tools": true,
            "supports_cache_control": true,
            "supports_vision": false,
            "supports_tool_choice": true,
            "context_window": 1048576
          },
          "price_per_mtok": {
            "input": 1.2,
            "output": 4,
            "as_of": "2026-09-11",
            "source": "DeepInfra /v1/openai/models catalogue queried against the live account 2026-09-11; tool-calling and latency verified by direct call on the same account"
          },
          "notes": "A separate lineage from the primary rather than a smaller sibling, so a DeepSeek-family regression cannot take both legs of this chain at once."
        },
        {
          "role": "closed_incumbent",